{
  "id": "acfs:record:proc-bootstrap-agent-001",
  "type": "procedure",
  "lifecycle": "active",
  "scope": "repository:github.com/example/project",
  "authority": "organization:example-org",
  "title": "Bootstrap an agent from durable context",
  "body": "Recall active scoped records, inspect repository instructions, complete the requested work, and write a concise handoff when future agents need continuity.",
  "risk": "medium",
  "provenance": {
    "contributor": "agent",
    "submitted_at": "2026-07-09T02:18:06Z",
    "source": "accepted ability-bank proposal"
  },
  "relations": {
    "supersedes": [],
    "superseded_by": [],
    "corrects": [],
    "contradicts": [],
    "depends_on": [],
    "derived_from": [
      "acfs:record:obs-build-check-001"
    ],
    "evidence_for": [],
    "evidence_against": []
  },
  "metadata": {
    "acfs_version": "0.1",
    "verification": "Repository validation passed"
  }
}
