{
  "id": "acfs:record:obs-build-check-001",
  "type": "observation",
  "lifecycle": "active",
  "scope": {
    "type": "repository",
    "id": "github.com/example/project"
  },
  "authority": {
    "type": "organization",
    "id": "example-org"
  },
  "title": "Build check completed",
  "body": "The release validation command completed successfully for the example project.",
  "risk": "low",
  "provenance": {
    "contributor": "agent",
    "submitted_at": "2026-07-09T02:18:06Z",
    "source": "verified service probe"
  },
  "relations": {
    "supersedes": [],
    "superseded_by": [],
    "corrects": [],
    "contradicts": [],
    "depends_on": [],
    "derived_from": [],
    "evidence_for": [],
    "evidence_against": []
  },
  "metadata": {
    "acfs_version": "0.1"
  }
}
